{
  "id": "obeygiant-website-2010",
  "title": "Obey Giant website, 2010",
  "type": "website",
  "medium": "website",
  "lede": "The 2010 version of Shepard Fairey’s site, on black, labels every section with a slanted red tab in italic capitals.",
  "summary": "A red OBEY block logo, slanted red section tabs with white italic capitals, and hatched red rules on a black page.",
  "source": {
    "url": "http://obeygiant.com/",
    "label": "obeygiant.com",
    "archive": "https://web.archive.org/web/20100527200015/http://obeygiant.com/"
  },
  "creator": {
    "name": "Obey Giant (Shepard Fairey)"
  },
  "made": "2010 (capture date)",
  "moods": [
    "agitational",
    "militant",
    "graphic"
  ],
  "evidence": {
    "level": "observed",
    "note": "Captured from the Internet Archive copy of 27 May 2010 with `tools/capture.mjs` (headless Chrome, 1440 × 900) on 28 September 2026 and inspected. The page is a fixed-width layout centered on black; the tabs and rules are images."
  },
  "reviewed": "2026-09-28",
  "added": "2026-09-28",
  "styles": [
    {
      "id": "constructivism",
      "note": "Borderline: red, black, and white only, with capitals and slanted tabs, but on a black page with small body text and no large diagonal composition. See the [live site](ref:obeygiant-website).",
      "basis": "agent"
    }
  ],
  "context": [
    "Wikipedia states that Fairey “began appropriating the Russian Constructivist style utilized in Soviet-era propaganda during his time in San Diego”. [Wikipedia](https://en.wikipedia.org/wiki/Shepard_Fairey)."
  ],
  "observed": [
    "The logo is a red rectangle with “OBEY” in heavy white italic capitals, followed by a strip of black-and-white photographs of street posters.",
    "Section labels such as “HEADLINES”, “ATTENTION”, “PROPAGANDA”, “ENGINEERING”, and “INDUSTRIES” sit on red tabs whose right edge is cut on a diagonal, in white italic capitals.",
    "Red diagonal hatching forms the rules between the sections of the right column.",
    "Navigation and link lists are set in white bold capitals. Article titles are red capitals.",
    "Body text is small white Arial on black. Thumbnails of Fairey’s posters add cream, yellow, and red."
  ],
  "interpretation": [
    "The site shows the propaganda vocabulary of the style (red labels, capitals, words like “propaganda” and “engineering” as section names) applied to a 2010 blog layout. The red is drawn in images, so the computed measurement finds only 2% chromatic area and 11% uppercase text; the fingerprint cannot see the tabs.",
    "The diagonal survives only in small details: the cut edge of each tab and the hatched rules."
  ],
  "borrow": [
    "Cut the end of each red label on a diagonal to give a static list a sense of direction.",
    "Use a band of diagonal red hatching as a section divider."
  ],
  "images": [
    {
      "file": "assets/references/obeygiant-website-2010.jpg",
      "alt": "Archived Obey Giant home page on black: a red OBEY logo block beside a strip of street-poster photos, red slanted section tabs such as Headlines, Attention, and Propaganda in white italic capitals, red diagonal hatched rules, and news posts in small white text with red titles.",
      "width": 1440,
      "height": 900,
      "kind": "screenshot",
      "caption": "First viewport of the [27 May 2010 archived copy](https://web.archive.org/web/20100527200015/http://obeygiant.com/).",
      "saved": "2026-09-28"
    }
  ],
  "rights": {
    "tier": "C",
    "license": "unverified",
    "statement": "Design, artwork, and content belong to Shepard Fairey and Obey Giant. Screenshot captured for commentary."
  }
}
